{
  "schema": "brand-mod.v0.1",
  "manifest": {
    "brand": "rocom",
    "displayName": "洛克王国",
    "sourceUrl": "https://rocom.qq.com/",
    "createdAt": "2026-07-09T15:03:29.808Z",
    "version": "0.1.0",
    "scope": {
      "intent": "Package RoCom visual language for demo validation and future business-page skinning.",
      "for": [
        "brand visual migration",
        "demo capability preview",
        "section-background-chain validation",
        "business-page skinning"
      ],
      "notFor": [
        "not a route generator",
        "not a page-content generator",
        "not a game-only format",
        "not coupled to /qdmp"
      ]
    },
    "producer": {
      "skill": "/brand",
      "decoupledFrom": [
        "/qdmp"
      ]
    }
  },
  "tokens": {
    "mapped": {
      "--du-bg-2": {
        "value": "#1f160b",
        "status": "mapped",
        "evidence": "Black/dark brown official visual baseline from site evidence.",
        "usage": "page background and dark section base"
      },
      "--du-bg-1": {
        "value": "#fff4c9",
        "status": "mapped",
        "evidence": "Warm parchment card/panel surface.",
        "usage": "card and panel surface"
      },
      "--du-text-1": {
        "value": "#251807",
        "status": "mapped",
        "evidence": "Dark brown title and nav text.",
        "usage": "primary readable text on warm surfaces"
      },
      "--du-text-2": {
        "value": "#5c4320",
        "status": "mapped",
        "evidence": "Secondary brown copy.",
        "usage": "secondary copy on warm surfaces"
      },
      "--du-text-3": {
        "value": "#8a6530",
        "status": "mapped",
        "evidence": "Weak warm label.",
        "usage": "labels and tertiary metadata"
      },
      "--du-border-1": {
        "value": "#6c3c16",
        "status": "mapped",
        "evidence": "Black-gold panel/button frame.",
        "usage": "button border and panel outlines"
      },
      "--du-primary-color": {
        "value": "#f5b537",
        "status": "mapped",
        "evidence": "Gold yellow CTA.",
        "usage": "primary CTA fill and active state"
      },
      "--du-primary-border": {
        "value": "#6c3c16",
        "status": "mapped",
        "evidence": "Dark gold CTA border.",
        "usage": "primary CTA outline"
      },
      "--du-primary-outline-color": {
        "value": "#ffe16a",
        "status": "mapped",
        "evidence": "Yellow active highlight.",
        "usage": "focus and selected state"
      },
      "--du-primary-soft-bg": {
        "value": "#fff0b2",
        "status": "mapped",
        "evidence": "Soft yellow active background.",
        "usage": "soft active pills"
      }
    },
    "styleOnly": {
      "--style-card-radius": {
        "value": "18px",
        "status": "style-only",
        "evidence": "Cloud panels are rounder than baseline cards.",
        "usage": "selected cards and media groups"
      },
      "--style-control-radius": {
        "value": "999px",
        "status": "style-only",
        "evidence": "Primary CTAs and filters use pill-like friendly controls.",
        "usage": "CTA and filter controls"
      },
      "--style-card-shadow": {
        "value": "0 14px 30px rgba(66,38,8,.2), inset 0 0 0 1px rgba(255,239,174,.72)",
        "status": "style-only",
        "evidence": "Soft dark/gold ambient lift.",
        "usage": "selective surface lift"
      },
      "--style-font-display": {
        "value": "MIANFEIZITI",
        "status": "style-only",
        "evidence": "Traced from official computed style.",
        "usage": "display headings, nav, CTA labels"
      },
      "--style-torn-paper-edge": {
        "value": "official section background chain",
        "status": "style-only",
        "evidence": "part2-part6 ::after backgrounds create layered torn-paper transitions.",
        "usage": "section-to-section transitions, not normal card borders"
      }
    },
    "dtcg": {
      "$description": "洛克王国 DTCG token contract generated from Brand MOD token mirrors.",
      "$extensions": {
        "echo.brand.schema": "brand-mod.tokens.dtcg/v0.1",
        "echo.brand.sourceFile": "migrations/rocom/brand-mod.json",
        "echo.brand.note": "DTCG is canonical for reusable token values; mapped/styleOnly are compatibility mirrors for current demo consumers."
      },
      "mapped": {
        "du-bg-2": {
          "$type": "color",
          "$value": "#1f160b",
          "$description": "Black/dark brown official visual baseline from site evidence.",
          "$extensions": {
            "echo.brand.target": "--du-bg-2",
            "echo.brand.channel": "mapped",
            "echo.brand.status": "mapped",
            "echo.brand.usage": "page background and dark section base",
            "echo.brand.legacyKey": "--du-bg-2",
            "echo.brand.evidence": "Black/dark brown official visual baseline from site evidence."
          }
        },
        "du-bg-1": {
          "$type": "color",
          "$value": "#fff4c9",
          "$description": "Warm parchment card/panel surface.",
          "$extensions": {
            "echo.brand.target": "--du-bg-1",
            "echo.brand.channel": "mapped",
            "echo.brand.status": "mapped",
            "echo.brand.usage": "card and panel surface",
            "echo.brand.legacyKey": "--du-bg-1",
            "echo.brand.evidence": "Warm parchment card/panel surface."
          }
        },
        "du-text-1": {
          "$type": "color",
          "$value": "#251807",
          "$description": "Dark brown title and nav text.",
          "$extensions": {
            "echo.brand.target": "--du-text-1",
            "echo.brand.channel": "mapped",
            "echo.brand.status": "mapped",
            "echo.brand.usage": "primary readable text on warm surfaces",
            "echo.brand.legacyKey": "--du-text-1",
            "echo.brand.evidence": "Dark brown title and nav text."
          }
        },
        "du-text-2": {
          "$type": "color",
          "$value": "#5c4320",
          "$description": "Secondary brown copy.",
          "$extensions": {
            "echo.brand.target": "--du-text-2",
            "echo.brand.channel": "mapped",
            "echo.brand.status": "mapped",
            "echo.brand.usage": "secondary copy on warm surfaces",
            "echo.brand.legacyKey": "--du-text-2",
            "echo.brand.evidence": "Secondary brown copy."
          }
        },
        "du-text-3": {
          "$type": "color",
          "$value": "#8a6530",
          "$description": "Weak warm label.",
          "$extensions": {
            "echo.brand.target": "--du-text-3",
            "echo.brand.channel": "mapped",
            "echo.brand.status": "mapped",
            "echo.brand.usage": "labels and tertiary metadata",
            "echo.brand.legacyKey": "--du-text-3",
            "echo.brand.evidence": "Weak warm label."
          }
        },
        "du-border-1": {
          "$type": "color",
          "$value": "#6c3c16",
          "$description": "Black-gold panel/button frame.",
          "$extensions": {
            "echo.brand.target": "--du-border-1",
            "echo.brand.channel": "mapped",
            "echo.brand.status": "mapped",
            "echo.brand.usage": "button border and panel outlines",
            "echo.brand.legacyKey": "--du-border-1",
            "echo.brand.evidence": "Black-gold panel/button frame."
          }
        },
        "du-primary-color": {
          "$type": "color",
          "$value": "#f5b537",
          "$description": "Gold yellow CTA.",
          "$extensions": {
            "echo.brand.target": "--du-primary-color",
            "echo.brand.channel": "mapped",
            "echo.brand.status": "mapped",
            "echo.brand.usage": "primary CTA fill and active state",
            "echo.brand.legacyKey": "--du-primary-color",
            "echo.brand.evidence": "Gold yellow CTA."
          }
        },
        "du-primary-border": {
          "$type": "color",
          "$value": "#6c3c16",
          "$description": "Dark gold CTA border.",
          "$extensions": {
            "echo.brand.target": "--du-primary-border",
            "echo.brand.channel": "mapped",
            "echo.brand.status": "mapped",
            "echo.brand.usage": "primary CTA outline",
            "echo.brand.legacyKey": "--du-primary-border",
            "echo.brand.evidence": "Dark gold CTA border."
          }
        },
        "du-primary-outline-color": {
          "$type": "color",
          "$value": "#ffe16a",
          "$description": "Yellow active highlight.",
          "$extensions": {
            "echo.brand.target": "--du-primary-outline-color",
            "echo.brand.channel": "mapped",
            "echo.brand.status": "mapped",
            "echo.brand.usage": "focus and selected state",
            "echo.brand.legacyKey": "--du-primary-outline-color",
            "echo.brand.evidence": "Yellow active highlight."
          }
        },
        "du-primary-soft-bg": {
          "$type": "color",
          "$value": "#fff0b2",
          "$description": "Soft yellow active background.",
          "$extensions": {
            "echo.brand.target": "--du-primary-soft-bg",
            "echo.brand.channel": "mapped",
            "echo.brand.status": "mapped",
            "echo.brand.usage": "soft active pills",
            "echo.brand.legacyKey": "--du-primary-soft-bg",
            "echo.brand.evidence": "Soft yellow active background."
          }
        }
      },
      "styleOnly": {
        "style-card-radius": {
          "$type": "dimension",
          "$value": "18px",
          "$description": "Cloud panels are rounder than baseline cards.",
          "$extensions": {
            "echo.brand.target": "--style-card-radius",
            "echo.brand.channel": "styleOnly",
            "echo.brand.status": "style-only",